{
  "battingFitItems": [
    {
      "blockingForFoundation": false,
      "canonicalDisplayName": "JW Hastings",
      "derivedRole": "BOWLER",
      "otherProfileBattingInnings": 0,
      "playerId": "012829ff",
      "playerTeamSeasonId": "pts:012829ff:ipl-2016:team-kolkata-knight-riders",
      "reviewId": "batting-fit:pts:012829ff:ipl-2016:team-kolkata-knight-riders",
      "reviewStatus": "PENDING",
      "reviewType": "BATTING_FIT",
      "seasonBattingInnings": 0,
      "seasonId": "ipl-2016",
      "teamId": "team-kolkata-knight-riders"
    },
    {
      "blockingForFoundation": false,
      "canonicalDisplayName": "MJ Suthar",
      "derivedRole": "BOWLER",
      "otherProfileBattingInnings": 1,
      "playerId": "025c4400",
      "playerTeamSeasonId": "pts:025c4400:ipl-2026:team-gujarat-titans",
      "reviewId": "batting-fit:pts:025c4400:ipl-2026:team-gujarat-titans",
      "reviewStatus": "PENDING",
      "reviewType": "BATTING_FIT",
      "seasonBattingInnings": 0,
      "seasonId": "ipl-2026",
      "teamId": "team-gujarat-titans"
    },
    {
      "blockingForFoundation": false,
      "canonicalDisplayName": "Yash Raj Punja",
      "derivedRole": "BOWLER",
      "otherProfileBattingInnings": 0,
      "playerId": "02dfebbe",
      "playerTeamSeasonId": "pts:02dfebbe:ipl-2026:team-rajasthan-royals",
      "reviewId": "batting-fit:pts:02dfebbe:ipl-2026:team-rajasthan-royals",
      "reviewStatus": "PENDING",
      "reviewType": "BATTING_FIT",
      "seasonBattingInnings": 0,
      "seasonId": "ipl-2026",
      "teamId": "team-rajasthan-royals"
    },
    {
      "blockingForFoundation": false,
      "canonicalDisplayName": "K Yadav",
      "derivedRole": "BOWLER",
      "otherProfileBattingInnings": 1,
      "playerId": "030f3089",
      "playerTeamSeasonId": "pts:030f3089:ipl-2023:team-rajasthan-royals",
      "reviewId": "batting-fit:pts:030f3089:ipl-2023:team-rajasthan-royals",
      "reviewStatus": "PENDING",
      "reviewType": "BATTING_FIT",
      "seasonBattingInnings": 0,
      "seasonId": "ipl-2023",
      "teamId": "team-rajasthan-royals"
    },
    {
      "blockingForFoundation": false,
      "canonicalDisplayName": "VRV Singh",
      "derivedRole": "BOWLER",
      "otherProfileBattingInnings": 2,
      "playerId": "034b4b7d",
      "playerTeamSeasonId": "pts:034b4b7d:ipl-2009:team-kings-xi-punjab",
      "reviewId": "batting-fit:pts:034b4b7d:ipl-2009:team-kings-xi-punjab",
      "reviewStatus": "PENDING",
      "reviewType": "BATTING_FIT",
      "seasonBattingInnings": 0,
      "seasonId": "ipl-2009",
      "teamId": "team-kings-xi-punjab"
    },
    {
      "blockingForFoundation": false,
      "canonicalDisplayName": "KT Maphaka",
      "derivedRole": "BOWLER",
      "otherProfileBattingInnings": 1,
      "playerId": "107c26fb",
      "playerTeamSeasonId": "pts:107c26fb:ipl-2024:team-mumbai-indians",
      "reviewId": "batting-fit:pts:107c26fb:ipl-2024:team-mumbai-indians",
      "reviewStatus": "PENDING",
      "reviewType": "BATTING_FIT",
      "seasonBattingInnings": 0,
      "seasonId": "ipl-2024",
      "teamId": "team-mumbai-indians"
    },
    {
      "blockingForFoundation": false,
      "canonicalDisplayName": "GS Sandhu",
      "derivedRole": "BOWLER",
      "otherProfileBattingInnings": 0,
      "playerId": "1558d83b",
      "playerTeamSeasonId": "pts:1558d83b:ipl-2015:team-delhi-daredevils",
      "reviewId": "batting-fit:pts:1558d83b:ipl-2015:team-delhi-daredevils",
      "reviewStatus": "PENDING",
      "reviewType": "BATTING_FIT",
      "seasonBattingInnings": 0,
      "seasonId": "ipl-2015",
      "teamId": "team-delhi-daredevils"
    },
    {
      "blockingForFoundation": false,
      "canonicalDisplayName": "S Kaushik",
      "derivedRole": "BOWLER",
      "otherProfileBattingInnings": 2,
      "playerId": "1da489ff",
      "playerTeamSeasonId": "pts:1da489ff:ipl-2017:team-gujarat-lions",
      "reviewId": "batting-fit:pts:1da489ff:ipl-2017:team-gujarat-lions",
      "reviewStatus": "PENDING",
      "reviewType": "BATTING_FIT",
      "seasonBattingInnings": 0,
      "seasonId": "ipl-2017",
      "teamId": "team-gujarat-lions"
    },
    {
      "blockingForFoundation": false,
      "canonicalDisplayName": "V Puthur",
      "derivedRole": "BOWLER",
      "otherProfileBattingInnings": 0,
      "playerId": "1e030637",
      "playerTeamSeasonId": "pts:1e030637:ipl-2025:team-mumbai-indians",
      "reviewId": "batting-fit:pts:1e030637:ipl-2025:team-mumbai-indians",
      "reviewStatus": "PENDING",
      "reviewType": "BATTING_FIT",
      "seasonBattingInnings": 0,
      "seasonId": "ipl-2025",
      "teamId": "team-mumbai-indians"
    },
    {
      "blockingForFoundation": false,
      "canonicalDisplayName": "AM Salvi",
      "derivedRole": "BOWLER",
      "otherProfileBattingInnings": 0,
      "playerId": "260fd380",
      "playerTeamSeasonId": "pts:260fd380:ipl-2009:team-delhi-daredevils",
      "reviewId": "batting-fit:pts:260fd380:ipl-2009:team-delhi-daredevils",
      "reviewStatus": "PENDING",
      "reviewType": "BATTING_FIT",
      "seasonBattingInnings": 0,
      "seasonId": "ipl-2009",
      "teamId": "team-delhi-daredevils"
    },
    {
      "blockingForFoundation": false,
      "canonicalDisplayName": "AM Salvi",
      "derivedRole": "BOWLER",
      "otherProfileBattingInnings": 0,
      "playerId": "260fd380",
      "playerTeamSeasonId": "pts:260fd380:ipl-2011:team-delhi-daredevils",
      "reviewId": "batting-fit:pts:260fd380:ipl-2011:team-delhi-daredevils",
      "reviewStatus": "PENDING",
      "reviewType": "BATTING_FIT",
      "seasonBattingInnings": 0,
      "seasonId": "ipl-2011",
      "teamId": "team-delhi-daredevils"
    },
    {
      "blockingForFoundation": false,
      "canonicalDisplayName": "AA Chavan",
      "derivedRole": "BOWLER",
      "otherProfileBattingInnings": 3,
      "playerId": "29d72eb2",
      "playerTeamSeasonId": "pts:29d72eb2:ipl-2013:team-rajasthan-royals",
      "reviewId": "batting-fit:pts:29d72eb2:ipl-2013:team-rajasthan-royals",
      "reviewStatus": "PENDING",
      "reviewType": "BATTING_FIT",
      "seasonBattingInnings": 0,
      "seasonId": "ipl-2013",
      "teamId": "team-rajasthan-royals"
    },
    {
      "blockingForFoundation": false,
      "canonicalDisplayName": "KR Sen",
      "derivedRole": "BOWLER",
      "otherProfileBattingInnings": 1,
      "playerId": "2e78f685",
      "playerTeamSeasonId": "pts:2e78f685:ipl-2023:team-rajasthan-royals",
      "reviewId": "batting-fit:pts:2e78f685:ipl-2023:team-rajasthan-royals",
      "reviewStatus": "PENDING",
      "reviewType": "BATTING_FIT",
      "seasonBattingInnings": 0,
      "seasonId": "ipl-2023",
      "teamId": "team-rajasthan-royals"
    },
    {
      "blockingForFoundation": false,
      "canonicalDisplayName": "KR Sen",
      "derivedRole": "BOWLER",
      "otherProfileBattingInnings": 1,
      "playerId": "2e78f685",
      "playerTeamSeasonId": "pts:2e78f685:ipl-2024:team-rajasthan-royals",
      "reviewId": "batting-fit:pts:2e78f685:ipl-2024:team-rajasthan-royals",
      "reviewStatus": "PENDING",
      "reviewType": "BATTING_FIT",
      "seasonBattingInnings": 0,
      "seasonId": "ipl-2024",
      "teamId": "team-rajasthan-royals"
    },
    {
      "blockingForFoundation": false,
      "canonicalDisplayName": "Zeeshan Ansari",
      "derivedRole": "BOWLER",
      "otherProfileBattingInnings": 0,
      "playerId": "36619795",
      "playerTeamSeasonId": "pts:36619795:ipl-2025:team-sunrisers-hyderabad",
      "reviewId": "batting-fit:pts:36619795:ipl-2025:team-sunrisers-hyderabad",
      "reviewStatus": "PENDING",
      "reviewType": "BATTING_FIT",
      "seasonBattingInnings": 0,
      "seasonId": "ipl-2025",
      "teamId": "team-sunrisers-hyderabad"
    },
    {
      "blockingForFoundation": false,
      "canonicalDisplayName": "YA Abdulla",
      "derivedRole": "BOWLER",
      "otherProfileBattingInnings": 1,
      "playerId": "4353bba5",
      "playerTeamSeasonId": "pts:4353bba5:ipl-2009:team-kings-xi-punjab",
      "reviewId": "batting-fit:pts:4353bba5:ipl-2009:team-kings-xi-punjab",
      "reviewStatus": "PENDING",
      "reviewType": "BATTING_FIT",
      "seasonBattingInnings": 0,
      "seasonId": "ipl-2009",
      "teamId": "team-kings-xi-punjab"
    },
    {
      "blockingForFoundation": false,
      "canonicalDisplayName": "B Muzarabani",
      "derivedRole": "BOWLER",
      "otherProfileBattingInnings": 0,
      "playerId": "449f4e3c",
      "playerTeamSeasonId": "pts:449f4e3c:ipl-2026:team-kolkata-knight-riders",
      "reviewId": "batting-fit:pts:449f4e3c:ipl-2026:team-kolkata-knight-riders",
      "reviewStatus": "PENDING",
      "reviewType": "BATTING_FIT",
      "seasonBattingInnings": 0,
      "seasonId": "ipl-2026",
      "teamId": "team-kolkata-knight-riders"
    },
    {
      "blockingForFoundation": false,
      "canonicalDisplayName": "N Burger",
      "derivedRole": "BOWLER",
      "otherProfileBattingInnings": 3,
      "playerId": "465aa633",
      "playerTeamSeasonId": "pts:465aa633:ipl-2024:team-rajasthan-royals",
      "reviewId": "batting-fit:pts:465aa633:ipl-2024:team-rajasthan-royals",
      "reviewStatus": "PENDING",
      "reviewType": "BATTING_FIT",
      "seasonBattingInnings": 0,
      "seasonId": "ipl-2024",
      "teamId": "team-rajasthan-royals"
    },
    {
      "blockingForFoundation": false,
      "canonicalDisplayName": "JP Behrendorff",
      "derivedRole": "BOWLER",
      "otherProfileBattingInnings": 2,
      "playerId": "4933f499",
      "playerTeamSeasonId": "pts:4933f499:ipl-2019:team-mumbai-indians",
      "reviewId": "batting-fit:pts:4933f499:ipl-2019:team-mumbai-indians",
      "reviewStatus": "PENDING",
      "reviewType": "BATTING_FIT",
      "seasonBattingInnings": 0,
      "seasonId": "ipl-2019",
      "teamId": "team-mumbai-indians"
    },
    {
      "blockingForFoundation": false,
      "canonicalDisplayName": "Yash Thakur",
      "derivedRole": "BOWLER",